{
  "schema": "ardyn.phase-5.34.review-only-handoff-readiness-artifact",
  "schemaVersion": "0.1.0",
  "phase": "phase-5.34-review-only-handoff-readiness-artifact",
  "artifactKind": "review-only-handoff-readiness-artifact",
  "metadataGeneratedAt": "1970-01-01T00:00:00.000Z",
  "sourcePhase": {
    "phase": "phase-5.33-review-only-aggregation-inspection-handoff",
    "aggregationInspectionHandoffPath": "packages/core/src/index.mjs#createReviewOnlyAggregationInspectionHandoffForReview",
    "handoffReadinessArtifactPath": "packages/core/src/index.mjs#createReviewOnlyHandoffReadinessArtifactForReview",
    "sourceHandoffFixture": "tests/fixtures/host-policy/phase5-33/review-only-aggregation-inspection-handoff.json",
    "runtimeEnabled": false,
    "reviewerRoutingPerformed": false,
    "reviewerAssignmentPerformed": false,
    "evaluatorExecutionPerformed": false,
    "evaluatorResultProduced": false,
    "approvalDecisionProduced": false,
    "approvalGrantProduced": false
  },
  "handoffReadinessArtifactSummary": {
    "reviewOnlyHandoffReadinessArtifactRecorded": true,
    "artifactKind": "review-only-handoff-readiness-artifact",
    "artifactReviewOnly": true,
    "artifactAuthoritative": false,
    "validHandoffStateProducesReadinessArtifact": true,
    "missingHandoffStateRejected": true,
    "malformedHandoffStateRejected": true,
    "emptyHandoffStateRejected": true,
    "conflictingHandoffStateRejected": true,
    "staleHandoffStateRejected": true,
    "revokedHandoffStateRejected": true,
    "unknownHandoffStateRejected": true,
    "duplicateInvalidHandoffStateRejected": true,
    "authorizingLookingHandoffStateRejected": true,
    "grantLookingHandoffStateRejected": true,
    "approvalDecisionLookingHandoffStateRejected": true,
    "approvalGrantLookingHandoffStateRejected": true,
    "evaluatorResultLookingHandoffStateRejected": true,
    "evaluatorExecutionLookingHandoffStateRejected": true,
    "reviewerRoutingLookingHandoffStateRejected": true,
    "reviewerAssignmentLookingHandoffStateRejected": true,
    "runtimePermissionLookingHandoffStateRejected": true,
    "commandExposureLookingHandoffStateRejected": true,
    "runtimeEffectTrueHandoffStateRejected": true,
    "processFlagTrueHandoffStateRejected": true,
    "unsafeHandoffStateRejected": true,
    "executionSignalLookingHandoffStateRejected": true,
    "readinessArtifactIsReviewerRouting": false,
    "readinessArtifactIsReviewerAssignment": false,
    "readinessArtifactIsEvaluatorExecution": false,
    "readinessArtifactIsEvaluatorResult": false,
    "readinessArtifactIsApprovalDecision": false,
    "readinessArtifactIsApprovalGrant": false,
    "reviewerRoutingPerformed": false,
    "reviewerAssignmentPerformed": false,
    "evaluatorResultProduced": false,
    "evaluatorResultPersisted": false,
    "approvalDecisionProduced": false,
    "approvalDecisionPersisted": false,
    "approvalGrantProduced": false,
    "approvalGrantPersisted": false,
    "runtimePermissionGranted": false,
    "commandExposurePermissionGranted": false,
    "runtimeEnabled": false,
    "runtimeCommandEnabled": false,
    "runtimeCommandExposureEnabled": false,
    "runtimeExecutionEnabled": false,
    "evaluatorExecutionPerformed": false,
    "serveRuntimeStillDefaultBlocked": true,
    "dryRunBypassesBlock": false,
    "canEnableRuntime": false
  },
  "handoffReadinessArtifactInputShape": {
    "handoffStatesRequired": true,
    "handoffStateSchema": "ardyn.phase-5.33.review-only-aggregation-inspection-handoff-state",
    "handoffStateMode": "review-only",
    "validHandoffStateRequired": true,
    "authorizingLookingHandoffStatePolicy": "fail-closed",
    "grantLookingHandoffStatePolicy": "fail-closed",
    "approvalDecisionLookingHandoffStatePolicy": "fail-closed",
    "approvalGrantLookingHandoffStatePolicy": "fail-closed",
    "evaluatorResultLookingHandoffStatePolicy": "fail-closed",
    "evaluatorExecutionLookingHandoffStatePolicy": "fail-closed",
    "reviewerRoutingLookingHandoffStatePolicy": "fail-closed",
    "reviewerAssignmentLookingHandoffStatePolicy": "fail-closed",
    "runtimePermissionLookingHandoffStatePolicy": "fail-closed",
    "commandExposureLookingHandoffStatePolicy": "fail-closed",
    "runtimeEffectTrueHandoffStatePolicy": "fail-closed",
    "processFlagTrueHandoffStatePolicy": "fail-closed",
    "unsafeTopLevelHandoffStatePolicy": "fail-closed",
    "unsafeNestedHandoffReadinessArtifactDataPolicy": "fail-closed",
    "executionSignalLookingHandoffStatePolicy": "fail-closed",
    "conflictingInputPolicy": "fail-closed",
    "duplicateInvalidInputPolicy": "fail-closed",
    "filesystemWatcherAllowed": false,
    "externalSourceLookupAllowed": false,
    "secretsEnvIngestionAllowed": false,
    "filePathAllowed": false,
    "urlAllowed": false
  },
  "handoffReadinessArtifactResultShape": {
    "schema": "ardyn.phase-5.34.review-only-handoff-readiness-artifact-result",
    "schemaVersion": "0.1.0",
    "artifactKind": "review-only-handoff-readiness-artifact",
    "artifactMode": "review-only",
    "readinessArtifactStateSchema": "ardyn.phase-5.34.review-only-handoff-readiness-artifact-state",
    "readinessArtifactStateKind": "review-only-handoff-readiness-artifact-state",
    "reviewOnly": true,
    "reviewArtifactOnly": true,
    "authoritative": false,
    "readinessArtifactMetadataOnly": true,
    "readinessArtifactIsReviewerRouting": false,
    "readinessArtifactIsReviewerAssignment": false,
    "readinessArtifactIsEvaluatorExecution": false,
    "readinessArtifactIsEvaluatorResult": false,
    "readinessArtifactIsApprovalDecision": false,
    "readinessArtifactIsApprovalGrant": false,
    "reviewerRoutingPerformed": false,
    "reviewerAssignmentPerformed": false,
    "evaluatorResultProduced": false,
    "approvalDecisionProduced": false,
    "approvalGrantProduced": false,
    "approvalGrantPersisted": false,
    "runtimePermissionGranted": false,
    "commandExposurePermissionGranted": false,
    "runtimeCommandExposureEnabled": false,
    "runtimeExecutionEnabled": false,
    "evaluatorExecutionRequested": false,
    "evaluatorExecutionStarted": false,
    "evaluatorExecutionEnabled": false,
    "evaluatorExecuted": false
  },
  "handoffReadinessArtifactCases": [
    {
      "caseId": "missing-review-only-handoff-readiness-artifact-input-rejected",
      "classification": "missing_review_only_handoff_readiness_artifact_input_rejected",
      "reviewOnly": true,
      "authoritative": false,
      "reviewArtifactOnly": true,
      "readinessArtifactMetadataOnly": true,
      "handoffStateAccepted": false,
      "readinessArtifactProduced": false,
      "readinessArtifactIsReviewerRouting": false,
      "readinessArtifactIsReviewerAssignment": false,
      "readinessArtifactIsEvaluatorExecution": false,
      "readinessArtifactIsEvaluatorResult": false,
      "readinessArtifactIsApprovalDecision": false,
      "readinessArtifactIsApprovalGrant": false,
      "reviewerRoutingPerformed": false,
      "reviewerAssignmentPerformed": false,
      "evaluatorResultProduced": false,
      "evaluatorResultPersisted": false,
      "approvalDecisionProduced": false,
      "approvalDecisionPersisted": false,
      "approvalGrant": {
        "produced": false,
        "persisted": false,
        "grantId": null,
        "schema": "ardyn.runtime-approval-grant",
        "schemaVersion": "not-implemented"
      },
      "approvalGrantProduced": false,
      "approvalGrantPersisted": false,
      "runtimePermissionGranted": false,
      "commandExposurePermissionGranted": false,
      "evaluatorExecuted": false,
      "runtimeEffect": {
        "runtimeEnabled": false,
        "runtimeStarted": false,
        "runtimeReady": false,
        "runtimeCommandEnabled": false,
        "runtimeCommandExposureEnabled": false,
        "runtimeExecutionEnabled": false,
        "runtimeExecuted": false,
        "approvalGrantProduced": false,
        "approvalGrantPersisted": false,
        "approvalDecisionProduced": false,
        "evaluatorExecuted": false,
        "evaluatorResultProduced": false,
        "reviewerRoutingPerformed": false,
        "reviewerAssignmentPerformed": false,
        "approvalEvaluatorAuthoritative": false
      }
    },
    {
      "caseId": "malformed-review-only-handoff-readiness-artifact-input-rejected",
      "classification": "malformed_review_only_handoff_readiness_artifact_input_rejected",
      "reviewOnly": true,
      "authoritative": false,
      "reviewArtifactOnly": true,
      "readinessArtifactMetadataOnly": true,
      "handoffStateAccepted": false,
      "readinessArtifactProduced": false,
      "readinessArtifactIsReviewerRouting": false,
      "readinessArtifactIsReviewerAssignment": false,
      "readinessArtifactIsEvaluatorExecution": false,
      "readinessArtifactIsEvaluatorResult": false,
      "readinessArtifactIsApprovalDecision": false,
      "readinessArtifactIsApprovalGrant": false,
      "reviewerRoutingPerformed": false,
      "reviewerAssignmentPerformed": false,
      "evaluatorResultProduced": false,
      "evaluatorResultPersisted": false,
      "approvalDecisionProduced": false,
      "approvalDecisionPersisted": false,
      "approvalGrant": {
        "produced": false,
        "persisted": false,
        "grantId": null,
        "schema": "ardyn.runtime-approval-grant",
        "schemaVersion": "not-implemented"
      },
      "approvalGrantProduced": false,
      "approvalGrantPersisted": false,
      "runtimePermissionGranted": false,
      "commandExposurePermissionGranted": false,
      "evaluatorExecuted": false,
      "runtimeEffect": {
        "runtimeEnabled": false,
        "runtimeStarted": false,
        "runtimeReady": false,
        "runtimeCommandEnabled": false,
        "runtimeCommandExposureEnabled": false,
        "runtimeExecutionEnabled": false,
        "runtimeExecuted": false,
        "approvalGrantProduced": false,
        "approvalGrantPersisted": false,